{
  "contractVersion": "masterboard.v1",
  "source": {
    "boardId": "5026186805",
    "itemId": "1000000001"
  },
  "today": "2026-10-28",
  "correlationId": "mb-5026186805-1000000001-exec0001",
  "idempotencyKey": "1000000001-20261027T030000Z",
  "selection": {
    "banks": [
      "BNZ"
    ]
  },
  "options": {
    "failurePolicy": "all-or-nothing",
    "includePdf": true
  },
  "data": {
    "Applicant 1 Full Name": "Jane Example",
    "Applicant 2 Full Name": "John Sample",
    "1st Property Address Street": "12 Example Street, Testville",
    "1st Property Address City": "Auckland",
    "1st Property Address Postcode": "0999",
    "Number of rooms proposed to be rented": "2",
    "Proposed weekly amount(s) per room": "250.00",
    "Banks to Send": "BNZ"
  }
}
