{
  "contractVersion": "masterboard.v1",
  "source": {
    "boardId": "5026186805",
    "itemId": "1000000002"
  },
  "today": "2026-10-27",
  "correlationId": "mb-5026186805-1000000002-exec0002",
  "idempotencyKey": "1000000002-20261027T030000Z",
  "selection": {
    "banks": [
      "ASB",
      "ANZ"
    ]
  },
  "options": {
    "failurePolicy": "per-document",
    "includePdf": false,
    "includeCandidates": true
  },
  "data": {
    "Applicant 1 Full Name": "Jane Example",
    "Applicant 2 Full Name": "John Sample",
    "Applicant 1 Physical Address Street": "12 Example Street",
    "Applicant 1 Physical Address Province": "Testville Region",
    "Applicant 1 Physical Address Country": "New Zealand",
    "Applicant 1 Physical Address Postcode": "0999",
    "1st Property Number of adults living in the property (excluding boarders)": "2",
    "1st Property Number of dependents living in the property": "1",
    "1st Property Number of bedrooms": "4",
    "Boarders - Boarder one name (if known)": "Alex Boarder",
    "Boarders - Board amount 1": "250",
    "Boarders - Board amount 1 frequency": "Weekly",
    "Boarders - Boarder two name (if known)": "Sam Lodger",
    "Boarders - Board amount 2": "230",
    "Boarders - Board amount 2 frequency": "Weekly",
    "Applicant 1 Current Occupation": "Fictional Test Analyst",
    "What do you intend to use your accounts for? (GHL Individual)": "Everyday personal banking",
    "Total credits or deposits (next 12 months) (ASB)": "$50,000-$150,000",
    "Cash deposits frequency (ASB)": "Infrequently",
    "Cash deposits average value per deposit (ASB)": "$500-$1,000",
    "Cash deposits activity details": "Occasional cash from a fictional weekend market stall",
    "International payments frequency (ASB)": "Never",
    "International payments average value per payment (ASB)": "Less than $500",
    "International payments activity details (including countries involved)": "None expected (fictional test data)",
    "Applicant 1 Physical Address": "12 Example Street, Testville",
    "Applicant 1 Residential City/Town": "Auckland",
    "Applicant 1 Residential Postcode/Zip": "0999",
    "ANZ Customer Number (if known)": "100200300"
  }
}
