{
  "contractVersion": "masterboard.v1",
  "today": "2026-10-28",
  "correlationId": "mb-5026186805-1000000002-exec0002",
  "idempotencyKey": "1000000002-20261028T020000Z",
  "source": {
    "boardId": "5026186805",
    "itemId": "1000000002"
  },
  "selection": {
    "banks": [
      "ASB"
    ]
  },
  "options": {
    "failurePolicy": "per-document",
    "includePdf": false,
    "includeCandidates": true
  },
  "data": {
    "Applicant 1 Organisation legal name (entity/company/trust/branch)": "Example Family Trust",
    "What is the objective of your trust/organisation?": "Hold the family home for fictional beneficiaries",
    "GHL Why have you come to Sovereign Home Loans?": "Other (please specify)",
    "GHL Other reasons to come": "Fictional: refinance from another lender",
    "Total credits or deposits (next 12 months) (GHL Trust)": "Less than $250K",
    "Sources of credits": "Dividends from investments, Donations",
    "GHL Other sources of credits": "",
    "Cash deposits frequency (GHL Trust)": "Occasionally (monthly / quarterly)",
    "International Money Transfers – In frequency": "Frequently (daily / weekly / fortnightly)",
    "Int Transfers IN - Average Value per Payment (GHL Trust)": "$1,000-$10,000",
    "International Money Transfers – Out frequency": "Infrequently",
    "Int Transfers OUT - Average Value per Payment (GHL Trust)": "Less than $1,000",
    "Receive transactions/funds from third parties?": "Yes",
    "If yes, purpose": "Fictional: family contributions to the mortgage",
    "Cash deposits activity details": "Occasional cash from a fictional weekend market stall",
    "International Money Transfers – In activity details (including countries)": "Fictional: rental income from Australia",
    "International Money Transfers – Out activity details (including countries)": "Fictional: annual fee paid to a UK trustee service",
    "Applicant 1 Full Name": "Jane Example",
    "Applicant 1 Current Occupation": "Fictional Test Analyst",
    "What do you intend to use your accounts for? (GHL Individual)": "Everyday personal banking",
    "Total credits or deposits (next 12 months) (ASB)": "$150,001-$250,000",
    "Cash deposits frequency (ASB)": "Infrequently",
    "Cash deposits average value per deposit (ASB)": "$500-$1,000",
    "International payments frequency (ASB)": "Occasionally (monthly / quarterly)",
    "International payments average value per payment (ASB)": "$500-$1,000",
    "International payments activity details (including countries involved)": "Fictional: annual transfer to a relative in Australia",
    "Use account for anything other than personal use?": "Yes",
    "Other account use details (GHL)": "Fictional: small online craft sales"
  }
}
